<!ELEMENT pets (dogs,penguins)>
<!ELEMENT dogs (dog*)>
<!ELEMENT penguins (penguin+)>
<!ELEMENT dog (name,health,love,strain?)>
<!ATTLIST dog id CDATA #REQUIRED>
<!ELEMENT penguin (name,health,love,sex)>
<!ATTLIST penguin id CDATA #REQUIRED>
<!ELEMENT name (#PCDATA)>
<!ELEMENT health (#PCDATA)>
<!ELEMENT love (#PCDATA)>
<!ELEMENT strain (#PCDATA)>
<!ELEMENT sex (#PCDATA)>
